A1: 股票代码 | B1: 股票简称 | C1: 预测ROE | D1: 市净率(pb)2019.03.28 | E1: PB中位数 | F1: 调整后的PB中位值 | G1: PB收益率 | H1: N=(1+ROE)*pb收益率-1 | I1: 不良率,拨备率 | K1: 营业利润增速 | L1: 是否增发 | M1: 分红情况
A2: 000001.SZ | B2: 平安银行 | C2: 11.18 | D2: 0.95 | E2: 0.91 | F2: =E2*1.1 -> 1.0010000000000001 | G2: =POWER(F2/D2,1/3) -> 1.0175837368160527 | H2: =(1+C2)*G2-1 -> 11.394169914419523 | I2: 0 | K2: 1. | L2: 0.
A3: 002142.SZ | B3: 宁波银行 | C3: 18.11 | D3: 1.6000000000000001 | E3: 1.37 | F3: 1.37 | G3: =POWER(F3/D3,1/3) -> 0.94958430566454599 | H3: =(1+C3)*G3-1 -> 17.146556081249475 | I3: 0. | K3: 1. | L3: -1.
A4: 600000.SH | B4: 浦发银行 | C4: 12.04 | D4: 0.73 | E4: 0.96 | F4: =E4*0.7 -> 0.67199999999999993 | G4: =POWER(F4/D4,1/3) -> 0.97278187680475559 | H4: =(1+C4)*G4-1 -> 11.685075673534012 | I4: -1. | K4: 0. | L4: -1. | M4: -1
A5: 600015.SH | B5: 华夏银行 | C5: 10.26 | D5: 0.63 | E5: 0.79 | F5: =E5*0.7 -> 0.55299999999999994 | G5: =POWER(F5/D5,1/3) -> 0.95747665513199653 | H5: =(1+C5)*G5-1 -> 9.781187136786281 | I5: 0. | K5: -1. | L5: -1. | M5: -1
A6: 600016.SH | B6: 民生银行 | C6: 12.25 | D6: 0.66 | E6: 1.01 | F6: =E6*0.9 -> 0.90900000000000003 | G6: =POWER(F6/D6,1/3) -> 1.1126023747284977 | H6: =(1+C6)*G6-1 -> 13.741981465152595 | I6: 0. | K6: 0. | L6: 0. | M6: -1
A7: 600036.SH | B7: 招商银行 | C7: 16.27 | D7: 1.61 | E7: 1.27 | F7: =1.27*1.2 -> 1.524 | G7: =POWER(F7/D7,1/3) -> 0.98186782847168586 | H7: =(1+C7)*G7-1 -> 15.956857397706013 | I7: 1. | K7: 1. | L7: 0.
A8: 601166.SH | B8: 兴业银行 | C8: 13.58 | D8: 0.83 | E8: 0.91 | F8: =0.91*0.7 -> 0.63700000000000001 | G8: =POWER(F8/D8,1/3) -> 0.91556063843687019 | H8: =(1+C8)*G8-1 -> 12.348874108409568 | I8: -1. | K8: -1. | L8: -1. | M8: -1
A9: 601288.SH | B9: 农业银行 | C9: 13.57 | D9: 0.83 | E9: 0.86 | F9: =0.86*1.1 -> 0.94600000000000006 | G9: =POWER(F9/D9,1/3) -> 1.0445703188790916 | H9: =(1+C9)*G9-1 -> 14.219389546068365 | I9: 1. | K9: 1. | L9: -1. | M9: 0
A10: 601328.SH | B10: 交通银行 | C10: 10.73 | D10: 0.73 | E10: 0.73 | F10: =0.73*1.2 -> 0.876 | G10: =POWER(F10/D10,1/3) -> 1.0626585691826111 | H10: =(1+C10)*G10-1 -> 11.46498501651203 | I10: 1. | K10: 1. | L10: 0. | M10: 0
A11: 601398.SH | B11: 工商银行 | C11: 13.54 | D11: 0.89
A12: 601818.SH | B12: 光大银行 | C12: 11.52 | D12: 0.72
A13: 601939.SH | B13: 建设银行 | C13: 13.81 | D13: 0.89
A14: 601988.SH | B14: 中国银行 | C14: 11.83 | D14: 0.74
A15: 601998.SH | B15: 中信银行 | C15: 10.86 | D15: 0.74
A16: 600919.SH | B16: 江苏银行 | C16: 21.07 | D16: 0.68 | E16: 1.04 | M16: -1